{
  "production_id": "if-2026-07-09-france-morocco",
  "production_date": "2026-07-09",
  "selected_match": "France vs Morocco",
  "home_team": "France",
  "away_team": "Morocco",
  "competition": "International Friendly",
  "kickoff_time": "2026-07-09T20:00:00+01:00",
  "match_priority": "editor_pick",
  "story_angle_optional": "France's control against Morocco's transition threat.",
  "editor_notes": "Use this editor-selected match for the Sprint 14 dry run."
}
